{
  "$schema": "https://json-schema.org/draft/2020-12/schema",
  "title": "Clutter catalog row",
  "description": "One kind of developer clutter, as data: where it lives, how its state is judged, and how it is removed. Rows are data: a new kind never needs a code change. Seeded from docs/2.0/research/D-clutter.md and Noo-Noo 0.7's leak signatures. test/noonoo/validate_clutter.py checks every row.",
  "type": "object",
  "required": ["id", "title", "group", "class", "paths", "every", "sources"],
  "properties": {
    "id": {"type": "string", "pattern": "^[a-z0-9-]+$", "description": "equals the file name"},
    "title": {"type": "string", "description": "a short name in plain words, used after 'The' in the growth line"},
    "group": {"type": "string"},
    "class": {"enum": ["cache", "tool", "build", "data", "leak", "report"], "description": "decision 1: cache, build and leak go to the Trash, tool runs its own command, data and report are never acted on"},
    "paths": {"type": "array", "items": {"type": "string"}, "description": "leaf globs with ~, ${cache:<tool>}, ${claude}, ${codex} and ${support}. For a family row, the folders whose children are grouped"},
    "names": {"type": "array", "items": {"type": "string"}, "description": "folder names found inside the checkouts, pruned at the first match"},
    "beside": {"type": "array", "items": {"type": "string"}, "description": "one of these files must sit next to a named folder"},
    "never": {"type": "array", "items": {"type": "string"}, "description": "paths no row may touch, nor any folder that holds them"},
    "skipWhenTracked": {"type": "boolean", "description": "kept when git tracks the folder"},
    "walk": {"type": "boolean", "description": "false for a mount that must never be walked"},
    "reportOnlyWhen": {"enum": ["root-owned"]},
    "signature": {"enum": ["agent-scratch", "open", "aged", "family"], "description": "Noo-Noo's leak signatures"},
    "minAge": {"type": "number", "description": "seconds the newest file must be old"},
    "session": {"type": "object", "description": "agent-scratch: deadAfter, entryIdle, transcriptWindow in seconds, scratchDir"},
    "family": {"type": "object", "description": "family: minMembers, exclude name prefixes"},
    "cleanup": {"type": "array", "items": {"type": "string"}, "description": "a tool row's own command as argv"},
    "dryRun": {"description": "the command's dry-run argv, or null when it has none"},
    "owner": {"enum": ["project", "session", "derived-data", "playwright-links", "pnpm-store", "simulator-device"]},
    "ownerSetting": {"type": "string", "description": "for data and report rows: who keeps it and where the setting lives"},
    "ownerNote": {"type": "string"},
    "advice": {"type": "string"},
    "workaround": {"type": "string"},
    "rebuild": {"type": "string"},
    "every": {"type": "number", "description": "the shortest time in seconds between two scans of the row, at least 600"},
    "measured_gib": {"type": "number"},
    "sources": {"type": "array", "items": {"type": "string"}}
  }
}
